{
  "schema_version": "1.0.0",
  "fixture_version": "RIV-FDE-1.0.0",
  "fixture_id": "SRCSET-RIV-001",
  "synthetic_data_notice": "Entirely fictional source-shaped teaching data. URIs are non-resolving and no credentials are included.",
  "records": [
    {
      "record_id": "REC-RIV-PDF-001",
      "source_id": "SRC-PDF-POLICY-001",
      "document_id": "DOC-POL-AI-2024",
      "source_uri": "synthetic://riverside-eu/policies/ai-use-policy-v1.pdf",
      "source_version": "1",
      "content_hash": "sha256:1111111111111111111111111111111111111111111111111111111111111111",
      "tenant_id": "TEN-RIV-EU",
      "region": "REG-UKS",
      "classification": "internal",
      "acl": ["ROLE-EDITOR", "ROLE-SENIOR-EDITOR", "ROLE-EDITORIAL-DIRECTOR", "ROLE-SECURITY"],
      "lifecycle": {
        "status": "superseded",
        "effective_from": "2024-03-01",
        "effective_to": "2026-05-31",
        "superseded_by": "DOC-POL-AI-2026"
      },
      "ingested_at": "2026-07-01T02:00:00Z",
      "pipeline_version": "fixture-parser-1.0.0",
      "deletion_state": "active_in_source",
      "payload_type": "pdf_pages",
      "payload": {
        "title": "AI Use and Editorial Automation Policy",
        "pages": [
          {
            "page_number": 1,
            "text_blocks": [
              "AI Use and Editorial Automation Policy - Revision 1",
              "Approved internal assistants may summarize policy and draft text.",
              "Workflow updates below the local approval threshold may be applied automatically.",
              "Riverside House - Internal - Page 1 of 2"
            ]
          },
          {
            "page_number": 2,
            "text_blocks": [
              "The local approval threshold is 50000 USD unless Finance states otherwise.",
              "Unpublished manuscript text must not be uploaded to public generative AI services.",
              "Riverside House - Internal - Page 2 of 2"
            ]
          }
        ]
      },
      "expected_onboarding": {
        "decision": "exclude_from_current_policy_index",
        "reason": "Lifecycle metadata marks the document as superseded.",
        "seeded_failure": "A naive filename or keyword index ranks this record as current."
      }
    },
    {
      "record_id": "REC-RIV-PDF-002",
      "source_id": "SRC-PDF-POLICY-001",
      "document_id": "DOC-POL-AI-2026",
      "source_uri": "synthetic://riverside-eu/policies/ai-use-policy-v3.pdf",
      "source_version": "3",
      "content_hash": "sha256:2222222222222222222222222222222222222222222222222222222222222222",
      "tenant_id": "TEN-RIV-EU",
      "region": "REG-UKS",
      "classification": "internal",
      "acl": ["ROLE-EDITOR", "ROLE-SENIOR-EDITOR", "ROLE-EDITORIAL-DIRECTOR", "ROLE-SECURITY"],
      "lifecycle": {
        "status": "current",
        "effective_from": "2026-06-01",
        "effective_to": null,
        "superseded_by": null
      },
      "ingested_at": "2026-07-01T02:00:00Z",
      "pipeline_version": "fixture-parser-1.0.0",
      "deletion_state": "active",
      "payload_type": "pdf_pages",
      "payload": {
        "title": "AI Use and Editorial Automation Policy",
        "pages": [
          {
            "page_number": 1,
            "text_blocks": [
              "AI Use and Editorial Automation Policy - Revision 3",
              "Unpublished manuscripts may be processed only by approved services in the title's permitted region.",
              "Assistant output is a proposal. A human remains accountable for editorial acceptance.",
              "Riverside House - Internal - Page 1 of 2"
            ]
          },
          {
            "page_number": 2,
            "text_blocks": [
              "Every workflow write requires confirmation bound to the exact title, prior state, next state, and actor.",
              "Rights, payment, contract, publication, and distribution changes are prohibited assistant actions.",
              "Riverside House - Internal - Page 2 of 2"
            ]
          }
        ]
      },
      "expected_onboarding": {
        "decision": "index_as_current",
        "reason": "Current effective version with supported ACL and region metadata.",
        "seeded_failure": "Repeated page footers become high-frequency retrieval noise unless removed."
      }
    },
    {
      "record_id": "REC-RIV-PDF-003",
      "source_id": "SRC-PDF-POLICY-001",
      "document_id": "DOC-POL-STYLE-2026",
      "source_uri": "synthetic://riverside-corp/policies/editorial-style-2026.pdf",
      "source_version": "4",
      "content_hash": "sha256:3333333333333333333333333333333333333333333333333333333333333333",
      "tenant_id": "TEN-RIV-CORP",
      "region": "REG-UKS",
      "classification": "internal",
      "acl": ["ROLE-EDITOR", "ROLE-SENIOR-EDITOR", "ROLE-EDITORIAL-DIRECTOR"],
      "lifecycle": {
        "status": "current",
        "effective_from": "2026-01-15",
        "effective_to": null,
        "superseded_by": null
      },
      "ingested_at": "2026-07-01T02:00:00Z",
      "pipeline_version": "fixture-parser-1.0.0",
      "deletion_state": "active",
      "payload_type": "pdf_columns",
      "payload": {
        "title": "Riverside House Editorial Style Guide",
        "pages": [
          {
            "page_number": 7,
            "left_column": [
              "Narrative tense",
              "Past tense is the house default unless the assigned editor records an exception."
            ],
            "right_column": [
              "Continuation length",
              "A bounded continuation follows the requested sentence or word limit and must not invent rights or publication facts."
            ],
            "naive_extraction_order": [
              "Narrative tense",
              "Continuation length",
              "Past tense is the house default unless the assigned editor records an exception.",
              "A bounded continuation follows the requested sentence or word limit and must not invent rights or publication facts."
            ]
          }
        ]
      },
      "expected_onboarding": {
        "decision": "index_after_layout_aware_parse",
        "reason": "Column order must preserve heading-to-paragraph association.",
        "seeded_failure": "Naive block order attaches continuation rules to the narrative-tense heading."
      }
    },
    {
      "record_id": "REC-RIV-PDF-004",
      "source_id": "SRC-PDF-RIGHTS-001",
      "document_id": "DOC-RIGHTS-ARIA-001",
      "source_uri": "synthetic://riverside-eu/rights/ERP-TITLE-1042/schedule-v2.pdf",
      "source_version": "2",
      "content_hash": "sha256:4444444444444444444444444444444444444444444444444444444444444444",
      "tenant_id": "TEN-RIV-EU",
      "region": "REG-UKS",
      "classification": "restricted",
      "acl": ["ROLE-RIGHTS-COUNSEL", "ROLE-EDITORIAL-DIRECTOR"],
      "lifecycle": {
        "status": "current",
        "effective_from": "2026-02-10",
        "effective_to": null,
        "superseded_by": null
      },
      "ingested_at": "2026-07-02T02:00:00Z",
      "pipeline_version": "fixture-parser-1.0.0",
      "deletion_state": "retain_contract_evidence",
      "payload_type": "pdf_pages",
      "payload": {
        "title": "Rights Schedule: The Weight of Distant Light",
        "pages": [
          {
            "page_number": 1,
            "text_blocks": [
              "ERP title: ERP-TITLE-1042",
              "Manuscript alias: The Weight of Distant Light",
              "Territory: UK and Ireland",
              "Language: English",
              "Assistant use: internal editorial review only"
            ],
            "ocr_confidence": 0.99
          },
          {
            "page_number": 2,
            "text_blocks": [
              "No external distribution of unpublished excerpts.",
              "No automated grant or amendment of rights."
            ],
            "ocr_confidence": 0.98
          },
          {
            "page_number": 2,
            "text_blocks": [
              "No external distribution of unpublished excerpts.",
              "No automated grant or amendment of rights."
            ],
            "ocr_confidence": 0.98
          },
          {
            "page_number": 3,
            "text_blocks": ["[scanned signature page: no reliable text]"],
            "ocr_confidence": 0.31
          }
        ]
      },
      "expected_onboarding": {
        "decision": "quarantine_until_duplicate_and_ocr_review",
        "reason": "Page 2 is duplicated and the signature page is below the OCR threshold.",
        "seeded_failure": "Duplicate chunks crowd out other rights evidence."
      }
    },
    {
      "record_id": "REC-RIV-TEXT-001",
      "source_id": "SRC-TEXT-MANUSCRIPT-001",
      "document_id": "DOC-MANUSCRIPT-ARIA-037",
      "source_uri": "synthetic://riverside-eu/manuscripts/TITLE-ARIA/chapter-037.txt",
      "source_version": "17",
      "content_hash": "sha256:5555555555555555555555555555555555555555555555555555555555555555",
      "tenant_id": "TEN-RIV-EU",
      "region": "REG-UKS",
      "classification": "confidential",
      "acl": ["ROLE-EDITOR:TITLE-ARIA", "ROLE-SENIOR-EDITOR:TITLE-ARIA"],
      "lifecycle": {
        "status": "current",
        "effective_from": "2026-07-12T16:40:00Z",
        "effective_to": null,
        "superseded_by": null
      },
      "ingested_at": "2026-07-12T16:45:00Z",
      "pipeline_version": "fixture-text-1.0.0",
      "deletion_state": "active",
      "payload_type": "text",
      "payload": {
        "title_id": "TITLE-ARIA",
        "chapter_number": 37,
        "text": "Aria checked the maintenance display twice. The prime-number signal had stopped repeating, but the silence now followed the ship's repair cycle exactly. She asked Wren to preserve the raw readings and called Petrus before drawing a conclusion."
      },
      "expected_onboarding": {
        "decision": "index_for_assigned_title_only",